{
  "record": "gate_decision",
  "schema_version": 1,
  "gate_packet_id": "gate-0002",
  "gate_packet_digest": "sha256:eeb0f98c6799539ece6cfdd3ba9f1c5ed9bb8782ee4a7072c3e21cf76965ac88",
  "authority": {
    "identity": "basho",
    "level": "signed_operator"
  },
  "decided_at": "2026-09-06T14:06:00Z",
  "decision": "record_assessment",
  "scope": {
    "run_id": "run-0001",
    "node": {
      "graph_id": "review_pilot",
      "node_id": "cs_synthesis",
      "revision": 1
    }
  },
  "authorization_ref": "sshsig:checkspan-gate/gate-0002",
  "assessment": {
    "claim_matrix_digest": "sha256:a58bc6af60ceae1c41a1e10d1dfda835036dad57e06ef564d7235944bbdcc5a7",
    "reviewed_claim_ids": [
      "c1",
      "c2"
    ],
    "rationale_ref": "notes:basho/2026-09-06",
    "outcome": "cannot_determine"
  }
}
