{
  "record": "gate_decision",
  "schema_version": 1,
  "gate_packet_id": "gate-0001",
  "gate_packet_digest": "sha256:6079582d942c1c26f9d36184fdf506847a2772fbfa5256e6053c730224430d65",
  "authority": {
    "identity": "basho",
    "level": "local_controller"
  },
  "decided_at": "2026-09-06T14:06:00Z",
  "decision": "revise",
  "scope": {
    "run_id": "run-0001",
    "node": {
      "graph_id": "review_pilot",
      "node_id": "cs_ci",
      "revision": 2
    }
  },
  "authorization_ref": "cli:local-operator-session"
}
